[
  {
    "name": "Enthused",
    "id": "idle-enthusiastic",
    "rarity": "rare",
    "duration_seconds": 15.941537
  },
  {
    "name": "Confusion",
    "id": "emote-confused",
    "rarity": "epic",
    "duration_seconds": 8.578827
  },
  {
    "name": "Let's Go Shopping",
    "id": "dance-shoppingcart",
    "rarity": "epic",
    "duration_seconds": 4.316035
  },
  {
    "name": "Roll",
    "id": "emote-roll",
    "rarity": "epic",
    "duration_seconds": 3.560517
  },
  {
    "name": "ROFL!",
    "id": "emote-rofl",
    "rarity": "epic",
    "duration_seconds": 6.314731
  },
  {
    "name": "Super Punch",
    "id": "emote-superpunch",
    "rarity": "rare",
    "duration_seconds": 3.751054
  },
  {
    "name": "Super Run",
    "id": "emote-superrun",
    "rarity": "epic",
    "duration_seconds": 6.273226
  },
  {
    "name": "Super Kick",
    "id": "emote-kicking",
    "rarity": "epic",
    "duration_seconds": 4.867992
  },
  {
    "name": "Monster Fail",
    "id": "emote-monster_fail",
    "rarity": "rare",
    "duration_seconds": 4.632708
  },
  {
    "name": "Peekaboo!",
    "id": "emote-peekaboo",
    "rarity": "epic",
    "duration_seconds": 3.629867
  },
  {
    "name": "Sumo Fight",
    "id": "emote-sumo",
    "rarity": "rare",
    "duration_seconds": 10.868834
  },
  {
    "name": "Charging",
    "id": "emote-charging",
    "rarity": "epic",
    "duration_seconds": 8.025079
  },
  {
    "name": "Ninja Run",
    "id": "emote-ninjarun",
    "rarity": "epic",
    "duration_seconds": 4.754721
  },
  {
    "name": "Proposing",
    "id": "emote-proposing",
    "rarity": "rare",
    "duration_seconds": 4.27888
  },
  {
    "name": "Rope Pull",
    "id": "emote-ropepull",
    "rarity": "rare",
    "duration_seconds": 8.769656
  },
  {
    "name": "Secret Handshake",
    "id": "emote-secrethandshake",
    "rarity": "epic",
    "duration_seconds": 3.879024
  },
  {
    "name": "I Believe I Can Fly",
    "id": "emote-wings",
    "rarity": "rare",
    "duration_seconds": 13.134487
  },
  {
    "name": "K-Pop Dance",
    "id": "dance-blackpink",
    "rarity": "epic",
    "duration_seconds": 7.150958
  },
  {
    "name": "Model",
    "id": "emote-model",
    "rarity": "rare",
    "duration_seconds": 6.490173
  },
  {
    "name": "Theatrical",
    "id": "emote-theatrical",
    "rarity": "rare",
    "duration_seconds": 8.591869
  },
  {
    "name": "Amused",
    "id": "emote-laughing2",
    "rarity": "epic",
    "duration_seconds": 5.056641
  },
  {
    "name": "Imaginary Jetpack",
    "id": "emote-jetpack",
    "rarity": "epic",
    "duration_seconds": 16.759457
  },
  {
    "name": "Bunny Hop",
    "id": "emote-bunnyhop",
    "rarity": "rare",
    "duration_seconds": 12.380685
  },
  {
    "name": "Collapse",
    "id": "emote-death2",
    "rarity": "rare",
    "duration_seconds": 4.855549
  },
  {
    "name": "Revival",
    "id": "emote-death",
    "rarity": "epic",
    "duration_seconds": 6.615967
  },
  {
    "name": "Disco",
    "id": "emote-disco",
    "rarity": "rare",
    "duration_seconds": 5.366973
  },
  {
    "name": "Relaxed",
    "id": "idle_layingdown2",
    "rarity": "epic",
    "duration_seconds": 21.546653
  },
  {
    "name": "Attentive",
    "id": "idle_layingdown",
    "rarity": "epic",
    "duration_seconds": 24.585168
  },
  {
    "name": "Cold",
    "id": "emote-cold",
    "rarity": "rare",
    "duration_seconds": 3.664348
  },
  {
    "name": "Fireball Lunge",
    "id": "emoji-hadoken",
    "rarity": "rare",
    "duration_seconds": 2.723709
  },
  {
    "name": "Arrogance",
    "id": "emoji-arrogance",
    "rarity": "epic",
    "duration_seconds": 6.869441
  },
  {
    "name": "Smirk",
    "id": "emoji-smirking",
    "rarity": "rare",
    "duration_seconds": 4.823158
  },
  {
    "name": "Lying",
    "id": "emoji-lying",
    "rarity": "epic",
    "duration_seconds": 6.313748
  },
  {
    "name": "Give Up",
    "id": "emoji-give-up",
    "rarity": "rare",
    "duration_seconds": 5.407888
  },
  {
    "name": "Punch",
    "id": "emoji-punch",
    "rarity": "epic",
    "duration_seconds": 1.755783
  },
  {
    "name": "Stinky",
    "id": "emoji-poop",
    "rarity": "epic",
    "duration_seconds": 4.795735
  },
  {
    "name": "Point",
    "id": "emoji-there",
    "rarity": "rare",
    "duration_seconds": 2.059095
  },
  {
    "name": "Annoyed",
    "id": "idle-loop-annoyed",
    "rarity": "rare",
    "duration_seconds": 17.058522
  },
  {
    "name": "Tap Loop",
    "id": "idle-loop-tapdance",
    "rarity": "epic",
    "duration_seconds": 6.261593
  },
  {
    "name": "Bummed",
    "id": "idle-loop-sad",
    "rarity": "rare",
    "duration_seconds": 6.052999
  },
  {
    "name": "Chillin'",
    "id": "idle-loop-happy",
    "rarity": "rare",
    "duration_seconds": 18.798322
  },
  {
    "name": "Aerobics",
    "id": "idle-loop-aerobics",
    "rarity": "epic",
    "duration_seconds": 8.507535
  },
  {
    "name": "Feel The Beat",
    "id": "idle-dance-headbobbing",
    "rarity": "rare",
    "duration_seconds": 25.367458
  },
  {
    "name": "Shy",
    "id": "idle-loop-shy",
    "rarity": "common",
    "duration_seconds": 16.47449
  },
  {
    "name": "Peace",
    "id": "emote-peace",
    "rarity": "rare",
    "duration_seconds": 5.755004
  },
  {
    "name": "Panic",
    "id": "emote-panic",
    "rarity": "epic",
    "duration_seconds": 2.850966
  },
  {
    "name": "Jump",
    "id": "emote-jumpb",
    "rarity": "rare",
    "duration_seconds": 3.584234
  },
  {
    "name": "Exasperated",
    "id": "emote-exasperated",
    "rarity": "rare",
    "duration_seconds": 2.367483
  },
  {
    "name": "Face Palm",
    "id": "emote-exasperatedb",
    "rarity": "rare",
    "duration_seconds": 2.722748
  },
  {
    "name": "Dab",
    "id": "emote-dab",
    "rarity": "epic",
    "duration_seconds": 2.717871
  },
  {
    "name": "Harlem Shake",
    "id": "emote-harlemshake",
    "rarity": "epic",
    "duration_seconds": 13.558597
  },
  {
    "name": "Tap Dance",
    "id": "emote-tapdance",
    "rarity": "epic",
    "duration_seconds": 11.057294
  },
  {
    "name": "Rainbow",
    "id": "emote-rainbow",
    "rarity": "epic",
    "duration_seconds": 2.813373
  },
  {
    "name": "Robot",
    "id": "emote-robot",
    "rarity": "epic",
    "duration_seconds": 7.607362
  },
  {
    "name": "Night Fever",
    "id": "emote-nightfever",
    "rarity": "epic",
    "duration_seconds": 5.488424
  },
  {
    "name": "Judo Chop",
    "id": "emote-judochop",
    "rarity": "rare",
    "duration_seconds": 2.427442
  },
  {
    "name": "Happy",
    "id": "emote-happy",
    "rarity": "common",
    "duration_seconds": 3.483462
  },
  {
    "name": "Moonwalk",
    "id": "emote-gordonshuffle",
    "rarity": "epic",
    "duration_seconds": 8.052307
  },
  {
    "name": "Zombie",
    "id": "idle_zombie",
    "rarity": "rare",
    "duration_seconds": 28.754937
  },
  {
    "name": "Faint",
    "id": "emote-fainting",
    "rarity": "rare",
    "duration_seconds": 18.423499
  },
  {
    "name": "Gangnam Style",
    "id": "emote-gangnam",
    "rarity": "epic",
    "duration_seconds": 7.275486
  },
  {
    "name": "Snow Angel",
    "id": "emote-snowangel",
    "rarity": "epic",
    "duration_seconds": 6.218627
  },
  {
    "name": "Posh",
    "id": "idle-posh",
    "rarity": "rare",
    "duration_seconds": 21.851256
  },
  {
    "name": "Falling Apart",
    "id": "emote-apart",
    "rarity": "epic",
    "duration_seconds": 4.809542
  },
  {
    "name": "Pouty Face",
    "id": "idle-sad",
    "rarity": "rare",
    "duration_seconds": 24.377214
  },
  {
    "name": "Irritated",
    "id": "idle-angry",
    "rarity": "epic",
    "duration_seconds": 25.427848
  },
  {
    "name": "Russian Dance",
    "id": "dance-russian",
    "rarity": "epic",
    "duration_seconds": 10.252905
  },
  {
    "name": "Curtsy",
    "id": "emote-curtsy",
    "rarity": "epic",
    "duration_seconds": 2.425714
  },
  {
    "name": "Bow",
    "id": "emote-bow",
    "rarity": "rare",
    "duration_seconds": 3.344036
  },
  {
    "name": "Ponder",
    "id": "idle-lookup",
    "rarity": "rare",
    "duration_seconds": 22.339865
  },
  {
    "name": "Fall",
    "id": "emote-fail1",
    "rarity": "rare",
    "duration_seconds": 5.617942
  },
  {
    "name": "Penny's Dance",
    "id": "dance-pennywise",
    "rarity": "rare",
    "duration_seconds": 1.214349
  },
  {
    "name": "Boo",
    "id": "emote-boo",
    "rarity": "epic",
    "duration_seconds": 4.501502
  },
  {
    "name": "Angry",
    "id": "emoji-angry",
    "rarity": "common",
    "duration_seconds": 5.760023
  },
  {
    "name": "Clap",
    "id": "emoji-clapping",
    "rarity": "common",
    "duration_seconds": 2.161757
  },
  {
    "name": "Hello",
    "id": "emote-hello",
    "rarity": "common",
    "duration_seconds": 2.734844
  },
  {
    "name": "Kiss",
    "id": "emote-kiss",
    "rarity": "common",
    "duration_seconds": 2.387175
  },
  {
    "name": "Laugh",
    "id": "emote-laughing",
    "rarity": "common",
    "duration_seconds": 2.69161
  },
  {
    "name": "Macarena",
    "id": "dance-macarena",
    "rarity": "common",
    "duration_seconds": 12.214141
  },
  {
    "name": "No",
    "id": "emote-no",
    "rarity": "common",
    "duration_seconds": 2.703034
  },
  {
    "name": "Raise The Roof",
    "id": "emoji-celebrate",
    "rarity": "common",
    "duration_seconds": 3.412258
  },
  {
    "name": "Sad",
    "id": "emote-sad",
    "rarity": "common",
    "duration_seconds": 5.411073
  },
  {
    "name": "Sit",
    "id": "idle-loop-sitfloor",
    "rarity": "common",
    "duration_seconds": 22.321055
  },
  {
    "name": "The Wave",
    "id": "emote-wave",
    "rarity": "common",
    "duration_seconds": 2.690873
  },
  {
    "name": "Thumbs Up",
    "id": "emoji-thumbsup",
    "rarity": "common",
    "duration_seconds": 2.702369
  },
  {
    "name": "Yes",
    "id": "emote-yes",
    "rarity": "common",
    "duration_seconds": 2.565001
  },
  {
    "name": "Blast Off",